"යවබ්  අඩවියක  පල  කර  තිබූ  ජල  යමෝටරයක්  විකිණීමට  අදාල  දැන්දවීමක්  අනුව",""
"සැකකරුවන්ද  විසින්ද  එය  මිලදී  ගන්දනා  බවට  හඟවමින්ද  විකුණුේකරුට  අත්තිකාරේ",""
"මුදලක්  තැන්දපත්  කරන  මුවායවන්ද  ඔහුයේ  බැංකු  ගිණුමට  සේබන්දිත  OTP  අංකය",""
"ලබායගන  යමම  මුදල්  වංචා  කිරීම","සිදුකර  ඇති  බවට  දරනට  සිදු  කරන  ලද"
"විමර්ශයේදී අනාවරණය වී ඇත.",""
"ස","ැකකරුවන්ද 2025.10.15 වන අද දින වාරියයපාල ගරු මයහ්ස්රාත් අිකරණය යවත"
"","ඉදිරිපත්  කිරීමට  නියමිතව  ඇති  අතර  අපරාධ  පරීක්ෂණ  යදපාර්තයේන්දතුයේ  වයඹ"
"පළාත් ඒකකයේ පරිගණක අපරාධ විමර්ශන අංශය වැඩිදුර විමර්ශන සිදුකරනු ලබයි.",""
