"පමහිදී  ගරු  මහජන  ආරක්ෂක  හො  පොේලිපේන්තු  කටයුු  අමොතයුමො  පමම  විසිර   ොපේ","","","",""
"අවස්ථොවට  සහභොගී  වීම  සනිටුහන්ත  කිරීම  සඳහො  එුමො  පවත  සමරුඵලක  පිළිගැන්තවීමක්ද","","","",""
"සිදු කරන ලදී.","","","",""
"විසිර   ොපේ  අවස්ථොව  සඳහො  ජොතික  ශිෂයභට  බලකොපේ  අධයක්ෂ  පේජේ  පජනරොල්","","","",""
"ඒ.සී.පී.ආේ. පේමතිලක මහතො, පරිපොලන දිසොව භොර පජයෂ්ඨ නිප ෝජය පපොලිස්පති ලලිත්","","","",""
"පතිනො ක මහතො, බස්නොහිර පළොත භොර පජයෂ්ඨ නිප ෝජය පපොලිස්පති සංජීව ධේමරත්න","","","",""
"මහතො, පුහුණු හො උසස් පුහුණු දිසොව භොර පජයෂ්ඨ නිප ෝජය පපොලිස්පති සජීව මැදවත්ත","","","",""
"මහතො  ඇුළු","උසස්  නිලධොරීන්ත","පමන්තම","අධයොපන","අමොතයොංශපේ  නිලධොරීන්ත,"
"විදුහල්පතිවරු, ගුරුභවුන්ත හො පදමොපි න්ත සහභොගි වි .","","","",""
"පමම අවස්ථොවට අදොල ඡො ොරූප කිහිප ක්","","","",""
